{
  "schemaVersion": "practice-topik35-listening-question-payload-v1",
  "packageId": "topik35-v1-listening-question-payload-v1",
  "sourcePackageId": "topik35-v1-listening-v1",
  "bundleId": "topik35-v1",
  "capturedAt": "2026-08-03",
  "status": "QUESTION_PAYLOAD_AND_VISUAL_QA_COMPLETE_LOAD_BLOCKED",
  "skill": "LISTENING",
  "sourceAuthority": {
    "questionArtifactId": "topik35-listening-writing-pdf",
    "questionArtifactSha256": "cc21da6b877b27f0d7d3550c732282d610dadcea03a80842881f17eda3d51323",
    "answerArtifactId": "topik35-answer-key-pdf",
    "answerArtifactSha256": "60fb5fa5e5a211609d0d6e36bc1cacc490c34ff5a0009e6952e931f9a850d17b",
    "transcriptMaterializedByThisSlice": false,
    "audioTimingMaterializedByThisSlice": false
  },
  "storagePolicy": {
    "logicalKeyOnly": true,
    "localDerivedAssetsIgnored": true,
    "objectStoreWrite": false,
    "bucketOrDeliveryUrlStored": false
  },
  "visualAssets": [
    {
      "assetId": "topik35-listening-q01-opt-1",
      "questionNumber": 1,
      "optionId": "opt_1",
      "logicalKey": "practice-seed/topik35-v1/derived/page-image/34feb02e3b36f059cd2a98054e6820a2af71921794a7273f768858bb6190981e.png",
      "mediaType": "image/png",
      "sha256": "34feb02e3b36f059cd2a98054e6820a2af71921794a7273f768858bb6190981e",
      "sizeBytes": 100069,
      "width": 480,
      "height": 322,
      "source": {
        "artifactId": "topik35-listening-writing-pdf",
        "pdfPage": 3,
        "printedPage": 1,
        "renderDpi": 200,
        "cropPixels": {
          "x": 357,
          "y": 490,
          "width": 480,
          "height": 322
        }
      },
      "qaStatus": "VISUALLY_VERIFIED"
    },
    {
      "assetId": "topik35-listening-q01-opt-2",
      "questionNumber": 1,
      "optionId": "opt_2",
      "logicalKey": "practice-seed/topik35-v1/derived/page-image/58db28b9bb96c1860a52d10ab43f6fe257fe95ae6f98a6a44d4d0c2f279d9987.png",
      "mediaType": "image/png",
      "sha256": "58db28b9bb96c1860a52d10ab43f6fe257fe95ae6f98a6a44d4d0c2f279d9987",
      "sizeBytes": 117014,
      "width": 480,
      "height": 322,
      "source": {
        "artifactId": "topik35-listening-writing-pdf",
        "pdfPage": 3,
        "printedPage": 1,
        "renderDpi": 200,
        "cropPixels": {
          "x": 947,
          "y": 490,
          "width": 480,
          "height": 322
        }
      },
      "qaStatus": "VISUALLY_VERIFIED"
    },
    {
      "assetId": "topik35-listening-q01-opt-3",
      "questionNumber": 1,
      "optionId": "opt_3",
      "logicalKey": "practice-seed/topik35-v1/derived/page-image/2922c9810db19429f93274fc4d4c0a8d2b6601ad9cd5f4b7c0fe2d10c13d949b.png",
      "mediaType": "image/png",
      "sha256": "2922c9810db19429f93274fc4d4c0a8d2b6601ad9cd5f4b7c0fe2d10c13d949b",
      "sizeBytes": 108817,
      "width": 480,
      "height": 322,
      "source": {
        "artifactId": "topik35-listening-writing-pdf",
        "pdfPage": 3,
        "printedPage": 1,
        "renderDpi": 200,
        "cropPixels": {
          "x": 357,
          "y": 847,
          "width": 480,
          "height": 322
        }
      },
      "qaStatus": "VISUALLY_VERIFIED"
    },
    {
      "assetId": "topik35-listening-q01-opt-4",
      "questionNumber": 1,
      "optionId": "opt_4",
      "logicalKey": "practice-seed/topik35-v1/derived/page-image/94cfa37241284c1681611a8b0aa57706da345f8050586abb6553fee7c26af5a3.png",
      "mediaType": "image/png",
      "sha256": "94cfa37241284c1681611a8b0aa57706da345f8050586abb6553fee7c26af5a3",
      "sizeBytes": 106555,
      "width": 480,
      "height": 322,
      "source": {
        "artifactId": "topik35-listening-writing-pdf",
        "pdfPage": 3,
        "printedPage": 1,
        "renderDpi": 200,
        "cropPixels": {
          "x": 947,
          "y": 847,
          "width": 480,
          "height": 322
        }
      },
      "qaStatus": "VISUALLY_VERIFIED"
    },
    {
      "assetId": "topik35-listening-q02-opt-1",
      "questionNumber": 2,
      "optionId": "opt_1",
      "logicalKey": "practice-seed/topik35-v1/derived/page-image/dcb820b0bb5f172cf57dd173f6a72f199630c552b3f8dcbd811ac78de39dae7a.png",
      "mediaType": "image/png",
      "sha256": "dcb820b0bb5f172cf57dd173f6a72f199630c552b3f8dcbd811ac78de39dae7a",
      "sizeBytes": 107009,
      "width": 480,
      "height": 330,
      "source": {
        "artifactId": "topik35-listening-writing-pdf",
        "pdfPage": 3,
        "printedPage": 1,
        "renderDpi": 200,
        "cropPixels": {
          "x": 357,
          "y": 1324,
          "width": 480,
          "height": 330
        }
      },
      "qaStatus": "VISUALLY_VERIFIED"
    },
    {
      "assetId": "topik35-listening-q02-opt-2",
      "questionNumber": 2,
      "optionId": "opt_2",
      "logicalKey": "practice-seed/topik35-v1/derived/page-image/48f601c7cdbcfa6c366e64a0b1e8149519841914f8ded05ce64d8e2428ed5f02.png",
      "mediaType": "image/png",
      "sha256": "48f601c7cdbcfa6c366e64a0b1e8149519841914f8ded05ce64d8e2428ed5f02",
      "sizeBytes": 107659,
      "width": 480,
      "height": 330,
      "source": {
        "artifactId": "topik35-listening-writing-pdf",
        "pdfPage": 3,
        "printedPage": 1,
        "renderDpi": 200,
        "cropPixels": {
          "x": 947,
          "y": 1324,
          "width": 480,
          "height": 330
        }
      },
      "qaStatus": "VISUALLY_VERIFIED"
    },
    {
      "assetId": "topik35-listening-q02-opt-3",
      "questionNumber": 2,
      "optionId": "opt_3",
      "logicalKey": "practice-seed/topik35-v1/derived/page-image/f8c966eeda6ee7bca68daa76c7b2de82d667952870cf27dd8ee0ede8629903ba.png",
      "mediaType": "image/png",
      "sha256": "f8c966eeda6ee7bca68daa76c7b2de82d667952870cf27dd8ee0ede8629903ba",
      "sizeBytes": 137630,
      "width": 480,
      "height": 330,
      "source": {
        "artifactId": "topik35-listening-writing-pdf",
        "pdfPage": 3,
        "printedPage": 1,
        "renderDpi": 200,
        "cropPixels": {
          "x": 357,
          "y": 1680,
          "width": 480,
          "height": 330
        }
      },
      "qaStatus": "VISUALLY_VERIFIED"
    },
    {
      "assetId": "topik35-listening-q02-opt-4",
      "questionNumber": 2,
      "optionId": "opt_4",
      "logicalKey": "practice-seed/topik35-v1/derived/page-image/f85eee083b6ddd6a8a985cd9bc5d952bac823da4b840f2a5f5575cc9f7ff641d.png",
      "mediaType": "image/png",
      "sha256": "f85eee083b6ddd6a8a985cd9bc5d952bac823da4b840f2a5f5575cc9f7ff641d",
      "sizeBytes": 114953,
      "width": 480,
      "height": 330,
      "source": {
        "artifactId": "topik35-listening-writing-pdf",
        "pdfPage": 3,
        "printedPage": 1,
        "renderDpi": 200,
        "cropPixels": {
          "x": 947,
          "y": 1680,
          "width": 480,
          "height": 330
        }
      },
      "qaStatus": "VISUALLY_VERIFIED"
    },
    {
      "assetId": "topik35-listening-q03-opt-1",
      "questionNumber": 3,
      "optionId": "opt_1",
      "logicalKey": "practice-seed/topik35-v1/derived/page-image/a4a37f27f0b656c71a8c6761975412849de67293eb3cb80f4e7172c392543909.png",
      "mediaType": "image/png",
      "sha256": "a4a37f27f0b656c71a8c6761975412849de67293eb3cb80f4e7172c392543909",
      "sizeBytes": 51140,
      "width": 480,
      "height": 390,
      "source": {
        "artifactId": "topik35-listening-writing-pdf",
        "pdfPage": 4,
        "printedPage": 2,
        "renderDpi": 200,
        "cropPixels": {
          "x": 357,
          "y": 278,
          "width": 480,
          "height": 390
        }
      },
      "qaStatus": "VISUALLY_VERIFIED"
    },
    {
      "assetId": "topik35-listening-q03-opt-2",
      "questionNumber": 3,
      "optionId": "opt_2",
      "logicalKey": "practice-seed/topik35-v1/derived/page-image/a912c7a0ae3a7152a6d4bf325e448c21264a60145e26caf5a0bc551e55165ebe.png",
      "mediaType": "image/png",
      "sha256": "a912c7a0ae3a7152a6d4bf325e448c21264a60145e26caf5a0bc551e55165ebe",
      "sizeBytes": 53042,
      "width": 480,
      "height": 390,
      "source": {
        "artifactId": "topik35-listening-writing-pdf",
        "pdfPage": 4,
        "printedPage": 2,
        "renderDpi": 200,
        "cropPixels": {
          "x": 947,
          "y": 278,
          "width": 480,
          "height": 390
        }
      },
      "qaStatus": "VISUALLY_VERIFIED"
    },
    {
      "assetId": "topik35-listening-q03-opt-3",
      "questionNumber": 3,
      "optionId": "opt_3",
      "logicalKey": "practice-seed/topik35-v1/derived/page-image/80f13db8b21aca1f96a9d2281945c3e6fe6f7700780188374bf1e030c935adf7.png",
      "mediaType": "image/png",
      "sha256": "80f13db8b21aca1f96a9d2281945c3e6fe6f7700780188374bf1e030c935adf7",
      "sizeBytes": 54084,
      "width": 480,
      "height": 402,
      "source": {
        "artifactId": "topik35-listening-writing-pdf",
        "pdfPage": 4,
        "printedPage": 2,
        "renderDpi": 200,
        "cropPixels": {
          "x": 357,
          "y": 704,
          "width": 480,
          "height": 402
        }
      },
      "qaStatus": "VISUALLY_VERIFIED"
    },
    {
      "assetId": "topik35-listening-q03-opt-4",
      "questionNumber": 3,
      "optionId": "opt_4",
      "logicalKey": "practice-seed/topik35-v1/derived/page-image/aa072166e1a9ad17782245403f0853fd4cc638f801a2e47f21209428aa9ad97b.png",
      "mediaType": "image/png",
      "sha256": "aa072166e1a9ad17782245403f0853fd4cc638f801a2e47f21209428aa9ad97b",
      "sizeBytes": 52024,
      "width": 480,
      "height": 402,
      "source": {
        "artifactId": "topik35-listening-writing-pdf",
        "pdfPage": 4,
        "printedPage": 2,
        "renderDpi": 200,
        "cropPixels": {
          "x": 947,
          "y": 704,
          "width": 480,
          "height": 402
        }
      },
      "qaStatus": "VISUALLY_VERIFIED"
    }
  ],
  "questions": [
    {